<?xml version="1.0" encoding="utf-8"?>
<!DOCTYPE company SYSTEM "Company.dtd">
<company>
	<info>
		<name>Merger Corp</name>
		<manager>Doc</manager>
		<location>Street 5</location>
	</info>
	<warehouses>
		<warehouse file="Warehouse13.xml" />
		<warehouse file="Warehouse14.xml" />
	</warehouses>
	<actions>
		<action type="merge" att="Storage" />
		<action type="sort" att="ascending" />
	</actions>
</company>