<?xml version="1.0" encoding="utf-8"?>
<!DOCTYPE company SYSTEM "Company.dtd">
<company>
	<info>
		<name>SCP Foundation</name>
		<manager>O5</manager>
		<location>Classified</location>
	</info>
	<warehouses>
		<warehouse file="Warehouse13.xml" />
	</warehouses>
	<actions>
		<act type="sort" att="decending" />
	</actions>
</company>